{
  "schema_version": 1,
  "generated_at": "2026-09-16",
  "source_manifest_sha256": "f36719320f9daaf83703a090219bcdf089ac5138770e717f2320569f2a34d12e",
  "shared_pipeline": {
    "pipeline": "proposal_classification",
    "preprocessing_version": "vision-scale-fit-rgb-v1",
    "detector": {
      "component_id": "sgblur-yolo11n-panoramax-169451970702aca0",
      "checkpoint_sha256": "698a70566938d25c3c1eaa49b89fc176fe2f3a20631a9a01fa56035613c7972a",
      "coreml": {
        "path": "iphone/SpeedConsumerApp/TSRModelPacks/DE.panoramax-bootstrap.tsrmodelpack/yolo11n_panoramax.mlmodelc",
        "sha256": "96c782afde62e1ede1d47d9d51b64359102170ed3ab6604838609869fcbd4589",
        "format": "coreml",
        "input_shape": [
          1,
          3,
          1280,
          1280
        ],
        "output_schema": "vision_recognized_objects_v1"
      },
      "litert": {
        "path": "android/app/src/main/assets/tsr/DE.panoramax-bootstrap.tsrmodelpack/yolo11n_panoramax_float16.tflite",
        "sha256": "e5490acd60ceb015336bed487b5e247c2728b2b98b6336790bf6ffe02a6f7207",
        "format": "tflite",
        "input_shape": [
          1,
          1280,
          1280,
          3
        ],
        "output_schema": "yolo_raw_xywh_class_scores_v1"
      }
    },
    "classifier": {
      "coreml_input": {
        "format": "coreml",
        "input_shape": [
          1,
          3,
          224,
          224
        ],
        "output_schema": "country_classifier_probabilities_v1"
      },
      "litert_input": {
        "format": "tflite",
        "input_shape": [
          1,
          224,
          224,
          3
        ],
        "output_schema": "country_classifier_probabilities_v1"
      },
      "output_schema": "country_classifier_probabilities_v1",
      "crop_policy": "shared_detector_proposal_crop_v1"
    },
    "temporal_contract": {
      "candidate_burst_aggregation": "shared_candidate_burst_v2",
      "validated_passage_required": true,
      "frame_score_cannot_change_speed_context": true
    }
  },
  "countries": [
    {
      "country": "FR",
      "artwork": {
        "manifest": "shared/tsr/sign-pictograms/national/FR/manifest.json",
        "selection": "shared/tsr/sign-pictograms/national/FR/selection.json",
        "display_assets": 114
      },
      "mapping": {
        "path": "shared/tsr/sign-pictograms/sources/panoramax-country-code-mapping-v1.json",
        "sha256": "fcbb43d424ff02775183b0f3c830035d6ff9acb9471ffb1fca594c45e196e62e",
        "country_code_count": 114,
        "legal_action_review": "pending"
      },
      "classifier_source": {
        "artifact_id": "panoramax-fr-classifier-7f2bdd",
        "revision": "7f2bdd58f20b3dfc7161c5aea7c672ce02749c8f",
        "sha256": "5e70142feffd01ac15ce4f1fc2c3ce929a6dadb7c71ccf06ea20059ca5757641",
        "size_bytes": 109854129,
        "uri": "https://huggingface.co/Panoramax/classify_fr_road_signs/resolve/7f2bdd58f20b3dfc7161c5aea7c672ce02749c8f/best.pt",
        "license_gate": "panoramax_cc_by_sa_and_ultralytics_review"
      },
      "exports": {
        "detector_reuse": "shared_german_reference_artifacts_reused_in_foreign_pack",
        "classifier_coreml": {
          "status": "passed",
          "evidence_sha256": "56722453f3b02c78509e5b9a72442fcbbad40e82a22ebb198043cca364c1ce55",
          "evidence_path": "iphone/SpeedConsumerApp/TSRModelPacks/FR.panoramax-bootstrap.tsrmodelpack/provenance/fr-coreml-export-report.json",
          "required_evidence": [
            "converted Core ML classifier artifact",
            "output label inventory bound to national selection",
            "hash and export configuration; compiled artifact SHA-256 is recorded in manifest.json"
          ]
        },
        "classifier_litert": {
          "status": "passed",
          "evidence_sha256": "ff0a28a3ff82b6cca1eafe4870f2e6a1f94990d04dc38ee570ea662b9694eabc",
          "evidence_path": "android/app/src/main/assets/tsr/FR.panoramax-bootstrap.tsrmodelpack/provenance/fr-tflite-export-report.json",
          "required_evidence": [
            "converted LiteRT classifier artifact",
            "output label inventory bound to national selection",
            "hash and export configuration; artifact SHA-256 is recorded in manifest.json"
          ]
        }
      },
      "calibration": {
        "status": "accepted_operational_benchmark",
        "evidence_sha256": "37d33d3662271ba9fd80d06e5584e9d8163abc5390db57ad9d3d7ba0a10ebd36",
        "evidence_path": "shared/tsr/foreign-calibration/FR-classifier-operational-benchmark-v1.json",
        "required_evidence": [
          "pinned Panoramax validation archive and extracted inventory",
          "native-score expected calibration error and confidence floors",
          "country classifier accuracy and inference-failure count",
          "explicit operational-field-bar decision and scope limitations"
        ],
        "runtime_output": "raw_score",
        "holdout_policy": "published_panoramax_validation_is_operational_benchmark_not_independent_holdout"
      },
      "parity": {
        "status": "passed",
        "evidence_sha256": "f9a4d138d582e94315481993569f6959ce5dd4bc680dae97278d556d7fa5f23f",
        "evidence_path": "shared/tsr/foreign-calibration/FR-mobile-parity-v1.json",
        "required_evidence": [
          "source PyTorch vs accelerated Core ML tensor/output comparison",
          "reference ONNX vs LiteRT tensor/output comparison",
          "shared RGB/255 preprocessing contract",
          "candidate-burst and validated-passage replay remains a separate product-contract gate"
        ]
      },
      "device_parity": {
        "ios": {
          "status": "pending",
          "evidence_sha256": null,
          "required_evidence": [
            "attached iPhone Core ML inference run",
            "sign display and confidence/state transition evidence",
            "minimum 3600 inferences and 1800 seconds drive evidence"
          ]
        },
        "android": {
          "status": "pending",
          "evidence_sha256": null,
          "required_evidence": [
            "attached Android CameraX/LiteRT inference run",
            "sign display and confidence/state transition evidence",
            "minimum 3600 inferences and 1800 seconds drive evidence"
          ]
        }
      },
      "runtime_manifest": {
        "status": "evaluation",
        "path": "iphone/SpeedConsumerApp/TSRModelPacks/FR.panoramax-bootstrap.tsrmodelpack/manifest.json",
        "manifest_sha256": "a2dee72fc56148d20406f70d05411697a89d41043a049ff8662e9e7827ec2e23",
        "registry_entry": "null_until_all_gates_pass"
      },
      "blockers": [
        "country semantic/action review is incomplete even though model-code mappings are materialized",
        "attached iPhone and Android device parity evidence is pending; the staged packs request MLComputeUnits.all and LiteRT GPU with CPU fallback",
        "runtime manifests are unsigned evaluation manifests and are not in the country registry until legal/action and device gates pass"
      ]
    },
    {
      "country": "NL",
      "artwork": {
        "manifest": "shared/tsr/sign-pictograms/national/NL/manifest.json",
        "selection": "shared/tsr/sign-pictograms/national/NL/selection.json",
        "display_assets": 111
      },
      "mapping": {
        "path": "shared/tsr/sign-pictograms/sources/panoramax-country-code-mapping-v1.json",
        "sha256": "fcbb43d424ff02775183b0f3c830035d6ff9acb9471ffb1fca594c45e196e62e",
        "country_code_count": 159,
        "legal_action_review": "pending"
      },
      "classifier_source": {
        "artifact_id": "panoramax-nl-classifier-7a8110",
        "revision": "7a811057049f6de207f909c0f1be2905fa9baf01",
        "sha256": "14c738b1d2b8d65af813f1d3cb20e50033274b481d02bbf062b8f714ed54bc53",
        "size_bytes": 26350065,
        "uri": "https://huggingface.co/Panoramax/classify_nl_road_signs/resolve/7a811057049f6de207f909c0f1be2905fa9baf01/classify_nl_road_signs.pt",
        "license_gate": "panoramax_cc_by_sa_and_ultralytics_review"
      },
      "exports": {
        "detector_reuse": "shared_german_reference_artifacts_reused_in_foreign_pack",
        "classifier_coreml": {
          "status": "passed",
          "evidence_sha256": "dbfbf5e3314bd7097b775524d4d4ab8b9f3ddf8701b27fb517cf407e9fdb3d28",
          "evidence_path": "iphone/SpeedConsumerApp/TSRModelPacks/NL.panoramax-bootstrap.tsrmodelpack/provenance/nl-coreml-export-report.json",
          "required_evidence": [
            "converted Core ML classifier artifact",
            "output label inventory bound to national selection",
            "hash and export configuration; compiled artifact SHA-256 is recorded in manifest.json"
          ]
        },
        "classifier_litert": {
          "status": "passed",
          "evidence_sha256": "972e8fc5cc58082cab2f4300a9ceaef06de97a3ff1c59d3afa52354f91c89af3",
          "evidence_path": "android/app/src/main/assets/tsr/NL.panoramax-bootstrap.tsrmodelpack/provenance/nl-tflite-export-report.json",
          "required_evidence": [
            "converted LiteRT classifier artifact",
            "output label inventory bound to national selection",
            "hash and export configuration; artifact SHA-256 is recorded in manifest.json"
          ]
        }
      },
      "calibration": {
        "status": "accepted_operational_benchmark",
        "evidence_sha256": "0fb025a56099d4d72ae5aa70c0f0c76dab169eb76304a25dd174ac6282e9ed4c",
        "evidence_path": "shared/tsr/foreign-calibration/NL-classifier-operational-benchmark-v1.json",
        "required_evidence": [
          "pinned Panoramax validation archive and extracted inventory",
          "native-score expected calibration error and confidence floors",
          "country classifier accuracy and inference-failure count",
          "explicit operational-field-bar decision and scope limitations"
        ],